{
  "project_id": "example-project",
  "project_profile_revision": "example-project-profile-v2",
  "contract_version": "1.0",
  "outcome_owner": {
    "role_id": "growth-coordinator",
    "accountability": "Own the bounded synthetic decision and its measurable learning outcome."
  },
  "growth_stage": "validation",
  "decision_question": "Which single synthetic bottleneck should the next bounded experiment address?",
  "success_signal": {
    "name": "qualified activation",
    "population": "eligible synthetic fixture users",
    "window": "14 days",
    "decision_rule": "Proceed only when the pre-registered threshold is met.",
    "source_ref": null
  },
  "guardrails": [{
    "name": "privacy",
    "failure_condition": "Raw personal data enters a persisted artifact.",
    "response": "stop"
  }],
  "stop_conditions": ["Evidence remains insufficient after two semantic revisions."],
  "resource_limits": {
    "max_duration_ms": 600000,
    "max_input_tokens": 88000,
    "max_output_tokens": 22000,
    "max_sources": 50,
    "max_variable_external_cost_eur": 0,
    "max_attempts_per_task": 2
  },
  "authority": {
    "allowed_actions": ["read_project", "write_internal_artifacts"],
    "forbidden_actions": ["publish", "spend", "contact_people"],
    "external_side_effects": false,
    "may_publish": false,
    "may_spend": false,
    "may_contact_people": false,
    "may_use_unofficial_collection": false
  },
  "data_policy": {
    "allowed_evidence_grades": ["authoritative", "verified", "directional"],
    "raw_personal_data_stored": false,
    "redaction_required": true,
    "retention_days": 30,
    "permitted_destinations": ["evidence", "records", "memory", "outbox"]
  },
  "proof_requirements": ["source_hashes", "professional_contract_checks", "governance_verdict", "human_exact_revision"],
  "learning_contract": {
    "learning_record_required": true,
    "causal_claim_requires_experiment": true,
    "destination": "memory/records",
    "next_decision_required": true
  },
  "created_at": "2026-08-31T12:00:00Z"
}
